{
  "agent_id": "L0-impact-assessor",
  "agent_version": "1.0.0",
  "execution_id": "exec-08bdca87-3806-5481-8e7f-9a7c193408c4",
  "workflow_execution_id": "wf-275a40ad-9396-5053-b789-77d0a80d9264",
  "status": "success",
  "content": {
    "type": "impact_assesment",
    "schema_version": "1.0",
    "items": {
      "impact_assessment": {
        "product_name": "Merchant Refund Console",
        "overall_impact_level": "Medium",
        "executive_summary": "Medium impact: new refund UI, ledger and mailer extended; no duplicate build, no flags.",
        "components_identified": [
          {
            "requirement": "FR-001",
            "component": "Refund Console UI",
            "component_type": "new",
            "blast_radius": "Low",
            "rationale_summary": "New isolated merchant screen"
          },
          {
            "requirement": "FR-002",
            "component": "Payments Ledger",
            "component_type": "existing",
            "blast_radius": "High",
            "rationale_summary": "Shared ledger gains new write path"
          },
          {
            "requirement": "FR-003",
            "component": "Mailer",
            "component_type": "existing",
            "blast_radius": "Low",
            "rationale_summary": "Template addition only"
          }
        ],
        "existing_systems_impacted": 2,
        "existing_systems_excluded": 1,
        "external_dependencies_count": 1,
        "flags": []
      },
      "dependency_graph": {
        "nodes": [
          {
            "id": "refund-console-ui",
            "type": "component",
            "component_type": "new",
            "label": "Refund Console UI",
            "source_requirement": [
              "FR-001"
            ]
          },
          {
            "id": "payments-ledger",
            "type": "component",
            "component_type": "existing",
            "label": "Payments Ledger",
            "source_requirement": [
              "FR-002"
            ]
          },
          {
            "id": "mailer",
            "type": "component",
            "component_type": "existing",
            "label": "Mailer",
            "source_requirement": [
              "FR-003"
            ]
          },
          {
            "id": "merchant-sso",
            "type": "external-dependency",
            "component_type": null,
            "label": "Merchant SSO",
            "source_requirement": []
          },
          {
            "id": "settlement-batch",
            "type": "existing-ci",
            "component_type": null,
            "label": "Settlement Batch",
            "source_requirement": []
          }
        ],
        "edges": [
          {
            "from": "merchant-sso",
            "to": "refund-console-ui",
            "type": "blocks"
          },
          {
            "from": "payments-ledger",
            "to": "refund-console-ui",
            "type": "depends-on"
          },
          {
            "from": "refund-console-ui",
            "to": "mailer",
            "type": "integrates-with"
          }
        ],
        "cycle_check": {
          "status": "PASS",
          "cycles_found": []
        },
        "critical_path": {
          "nodes": [
            "payments-ledger",
            "refund-console-ui"
          ],
          "tied_chains": [
            [
              "payments-ledger",
              "refund-console-ui"
            ],
            [
              "merchant-sso",
              "refund-console-ui"
            ]
          ],
          "length": 1,
          "rationale": "Longest-path over blocks/depends-on edges from every root; max length 1 edge(s); 2 chains tied at max, all reported: payments-ledger -> refund-console-ui | merchant-sso -> refund-console-ui"
        }
      }
    },
    "artifacts": [
      {
        "id": "artifact-01",
        "type": "document",
        "name": "Merchant Refund Console-impact-assessment.md",
        "format": "md",
        "content": "# Impact Assessment: Merchant Refund Console\n\n## Legend\n| Field | Value |\n|---|---|\n| Source 1 | PRD: `L0-requirements-prd-composer`|\n| Status (*Draft / In-Review / Approved*) | Draft |\n| Approved by (Human Name) | *Human Name* |\n| Date of Approval | *Date* |\n| Human Approval Comments | *Comments* |\n\n> KB: kb-L1-architecture-principles (Confluence page_id 524091393) — mode: cross-check mode\n\n## Executive Summary & Overview\nMerchant Refund Console lets merchants self-serve refunds, removing the manual support-ticket path.\n\nOne new component is added and two existing systems are extended. The Payments Ledger carries the highest blast radius because every refund writes to it.\n- **Overall impact level:** Medium — 1 of 3 FR rows High (Payments Ledger); others Low/Medium\n- **Existing systems:** 2 impacted, 1 explicitly excluded by architecture decision; duplicate-build risk: none found\n- **External dependencies:** 1 total, 0 newly surfaced by this assessment\n- **Flags:** None\n\n## Non-Functional & Regulatory Impact\nLedger writes must stay inside the existing 500 ms p99 posting SLA (CON-001). Refund records follow the existing 7-year financial retention.\n\n## Existing-System Impact\n**Capability check (service catalog, service grain):** Closest: SVC-001 Payments Service (posts charges and refunds via API but has no merchant UI — reused, not duplicated); SVC-002 Notification Service (reused for FR-003).\n\n**Technical impact check (CMDB, configuration-item grain):**\n\n| Existing System (CI) | impacted? | How / Why Not | Component(s) |\n|---|---|---|---|\n| Payments Ledger (CI-1001) | Yes | New refund posting type | FR-002 |\n| Mailer (CI-1002) | Yes | New confirmation template | FR-003 |\n| Settlement Batch (CI-1003) | No — by architecture decision | Refunds settle through existing ledger nightly batch unchanged; KB-consistent | — |\n\n## Components Identified\n| Requirement | Component (new/existing) | Blast Radius | Rationale |\n|---|---|---|---|\n| FR-001 | Refund Console UI (new) | Low | New merchant screen; isolated. |\n| FR-002 | Payments Ledger (existing) | High | Shared financial system of record gains a new write path. |\n| FR-003 | Mailer (existing) | Low | Template only. |\n\n## Data Model & Schema Impact\nNew RefundRequest entity; Payments Ledger gains REFUND posting type.\n\n## Integration Landscape & External Dependencies\n- **Upstream (enterprise platform):** Merchant SSO — Merchant login gate for the console.\n\n## Assumptions & Out of Scope\nSettlement Batch out of scope; chargebacks out of scope.\n\n## Dependency Graph\n```mermaid\n%%{ init: { 'flowchart': { 'nodeSpacing': 80, 'rankSpacing': 80 } } }%%\nflowchart TD\n    refund-console-ui[\"Refund Console UI\"]\n    payments-ledger[\"Payments Ledger\"]\n    mailer[\"Mailer\"]\n    merchant-sso([\"Merchant SSO\"])\n    settlement-batch[[\"Settlement Batch\"]]\n    merchant-sso -->|blocks| refund-console-ui\n    payments-ledger -->|depends on| refund-console-ui\n    refund-console-ui -.->|integrates with| mailer\n    classDef newNode fill:#4a7fc1,stroke:#2d5a8e,color:#fff\n    classDef existingNode fill:#e8a838,stroke:#b07820,color:#fff\n    classDef unaffectedNode fill:#8c8c8c,stroke:#5a5a5a,color:#fff\n    class refund-console-ui newNode\n    class payments-ledger,mailer existingNode\n    class settlement-batch unaffectedNode\n    %% CRITICAL PATH: payments-ledger -> refund-console-ui (length 1)\n    %% CRITICAL PATH: merchant-sso -> refund-console-ui (length 1)\n```\n",
        "description": "Generated impact assessment",
        "produced_by": "L0-impact-assessor"
      }
    ],
    "execution_summary": "• Assessment: 2 services and 3 CIs checked; 3 FR rows mapped to 3 components; overall impact Medium; no CMDB/KB mismatch; exports fresh\n• Graph: 5 nodes / 3 edges; cycle_check PASS (DFS, 0 cycles); critical path length 1, 2 tied chain(s): payments-ledger -> refund-console-ui | merchant-sso -> refund-console-ui; mermaid 1:1 confirmed (same ids, counts, directions)\n• KBs consulted: kb-L1-architecture-principles via Confluence page 524091393 — cross-check mode; ledger write principles checked\n• Tools invoked: tool-L1-confluence-fetch-page (page_id 524091393) — success\n• Artifact Merchant Refund Console-impact-assessment.md produced and inlined in artifacts[0].content, ready for downstream evaluator\n• Reflection: no fixes required\n• Gaps flagged: none"
  }
}